{
  "$schema": "../../agent-manifest.schema.json",
  "schemaVersion": 1,
  "id": "pattern:form-field",
  "name": "FormField",
  "namespace": "pattern",
  "tier": "groups",
  "status": "stable",
  "category": "Forms",
  "description": "The composition rules/composition.json requires for the form-submit pattern. Clones the child control to inject id, aria-describedby and aria-invalid, so the three relationships that make a field usable cannot be forgotten.",
  "intent": "A labelled control with its description and error, wired together correctly.",
  "authority": {
    "source": "src/components/patterns/form-field.tsx",
    "mirrorSpec": "design-system/components/patterns/form-field/form-field.md",
    "contract": "design-system/components/patterns/form-field/form-field.agent.json",
    "prompt": "design-system/components/patterns/form-field/agentic-prompt.md",
    "preview": "design-system/components/patterns/form-field/form-field.preview.html",
    "note": "src/ is authoritative. If this contract disagrees with the source, implement from the source and report the drift."
  },
  "platforms": [
    "web",
    "react"
  ],
  "dependencies": {
    "internal": [
      "ui:label"
    ],
    "external": []
  },
  "exports": [
    "FormField"
  ],
  "variants": [],
  "sizes": [],
  "states": [
    "Default",
    "Required",
    "Described",
    "Invalid"
  ],
  "props": [
    {
      "name": "className",
      "type": "string",
      "required": false,
      "hint": "Merged with the component classes via cn(). Use for layout only — never to override a variant that already exists."
    }
  ],
  "javascriptApi": {
    "import": "import { FormField } from \"@/components/patterns/form-field\"",
    "exports": [
      "FormField"
    ],
    "forwardsRef": true,
    "asChild": false,
    "notes": []
  },
  "tokens": {
    "semantic": [
      "destructive",
      "muted"
    ],
    "utilities": [
      "text-destructive",
      "text-muted"
    ]
  },
  "accessibility": {
    "role": "none",
    "keyboard": [
      "Clicking the label focuses the control"
    ],
    "requiredAttributes": [
      "label",
      "A single React element as children"
    ],
    "liveRegion": "The error message is role=\"alert\"",
    "handledByRadix": false,
    "notes": [
      "aria-describedby lists description then error, in that reading order — description is context, error is the newest news.",
      "The child is cloned, so props you set on it yourself win over the injected ones. That is deliberate: you can override the generated id.",
      "Children must be exactly one element. A fragment or an array breaks cloneElement.",
      "The required asterisk is aria-hidden and paired with an sr-only \"(required)\" — an asterisk announces as \"star\" or not at all."
    ]
  },
  "rules": {
    "allowedChildren": [],
    "forbiddenChildren": [],
    "forbiddenUsage": [
      "Multiple children",
      "Omitting the label",
      "Asterisk as the only required indicator",
      "Use for non-form controls"
    ],
    "agentRules": [
      "Exactly one child element.",
      "Use ui:form inside react-hook-form; this is for standalone fields.",
      "Never omit the label. Use sr-only if it must be visually hidden.",
      "Pass error only when validation has actually failed — role=\"alert\" interrupts."
    ]
  },
  "relatedComponents": [
    {
      "id": "ui:form",
      "note": "react-hook-form integration"
    },
    {
      "id": "ui:label",
      "note": "The label alone"
    },
    {
      "id": "ui:input",
      "note": "The usual child"
    }
  ],
  "gaps": [],
  "generatedAt": "2026-09-11T05:07:37.563Z",
  "curated": true
}
