{
  "$schema": "../../agent-manifest.schema.json",
  "schemaVersion": 1,
  "id": "ai:ai-button",
  "name": "AIButton",
  "namespace": "ai",
  "tier": "atoms",
  "status": "stable",
  "category": "AI",
  "description": "The AI call to action. Gradient primary, outlined secondary, ghost tertiary. Status is part of the contract: loading, complete and error are visual states the caller drives from real work.",
  "intent": "Commit to something a machine proposed.",
  "authority": {
    "source": "src/components/ai/ai-button.tsx",
    "mirrorSpec": "design-system/components/ai/ai-button/ai-button.md",
    "contract": "design-system/components/ai/ai-button/ai-button.agent.json",
    "prompt": "design-system/components/ai/ai-button/agentic-prompt.md",
    "preview": "design-system/components/ai/ai-button/ai-button.preview.html",
    "note": "src/ is authoritative. If this contract disagrees with the source, implement from the source and report the drift."
  },
  "platforms": [
    "web",
    "react"
  ],
  "dependencies": {
    "internal": [],
    "external": [
      "class-variance-authority",
      "lucide-react"
    ]
  },
  "exports": [
    "AIButton",
    "aiButtonVariants"
  ],
  "variants": [
    "primary",
    "secondary",
    "tertiary"
  ],
  "sizes": [
    "sm",
    "md",
    "lg"
  ],
  "states": [
    "Default",
    "Loading",
    "Complete",
    "Error",
    "Disabled"
  ],
  "props": [
    {
      "name": "variant",
      "type": "\"primary\" | \"secondary\" | \"tertiary\"",
      "default": "\"primary\"",
      "required": false,
      "hint": "See variantGuidance in the mirror spec for when to use each."
    },
    {
      "name": "size",
      "type": "\"sm\" | \"md\" | \"lg\"",
      "default": "\"md\"",
      "required": false,
      "hint": "See sizeGuidance in the mirror spec."
    },
    {
      "name": "status",
      "type": "\"default\" | \"loading\" | \"complete\" | \"error\"",
      "default": "\"default\"",
      "required": false,
      "hint": "One of the status values declared in aiButtonVariants."
    },
    {
      "name": "className",
      "type": "string",
      "required": false,
      "hint": "Merged with the component classes via cn(). Use for layout only — never to override a variant that already exists."
    }
  ],
  "javascriptApi": {
    "import": "import { AIButton, aiButtonVariants } from \"@/components/ai/ai-button\"",
    "exports": [
      "AIButton",
      "aiButtonVariants"
    ],
    "forwardsRef": true,
    "asChild": false,
    "notes": []
  },
  "tokens": {
    "semantic": [
      "accent",
      "ai-accent",
      "ai-muted",
      "border",
      "destructive",
      "foreground"
    ],
    "utilities": [
      "bg-accent",
      "border-border",
      "border-destructive",
      "from-ai-accent",
      "from-destructive",
      "ring-ai-accent",
      "text-accent",
      "text-ai-accent",
      "text-ai-muted",
      "text-destructive",
      "text-foreground",
      "to-ai-accent",
      "to-destructive"
    ]
  },
  "accessibility": {
    "role": "button",
    "keyboard": [
      "Enter — activate",
      "Space — activate"
    ],
    "requiredAttributes": [
      "label is required — there is no icon-only form"
    ],
    "handledByRadix": false,
    "notes": [
      "status=\"loading\" sets aria-busy and disables the button, so the action cannot be double-fired.",
      "The status icon is aria-hidden; the label must change to carry the meaning (\"Applying…\", \"Applied\").",
      "The error state colours the button but does not explain the failure. Render the reason adjacent."
    ]
  },
  "rules": {
    "allowedChildren": [],
    "forbiddenChildren": [],
    "forbiddenUsage": [
      "Use on standard product actions",
      "Simulated loading",
      "Error state with no explanation"
    ],
    "agentRules": [
      "Only for actions originating from AI output. Standard actions use ui:button.",
      "status must track real work — never animate loading to simulate effort.",
      "Change the label with the status; the icon alone is not announced.",
      "On error, say what failed and what the user can do next."
    ]
  },
  "experienceMetadata": {
    "experienceMode": [
      "AI Assisted",
      "Adaptive",
      "AI Led"
    ],
    "aiBehavior": [
      "Confirm",
      "Apply"
    ],
    "accountability": [
      "Attribution",
      "Approval"
    ],
    "humanGestureRequired": true,
    "reversible": "conditional"
  },
  "relatedComponents": [
    {
      "id": "ui:button",
      "note": "Standard actions"
    },
    {
      "id": "ai:ai-action",
      "note": "The full decision row"
    }
  ],
  "gaps": [],
  "generatedAt": "2026-09-11T05:07:37.563Z",
  "curated": true
}
