{
  "$schema": "../../agent-manifest.schema.json",
  "schemaVersion": 1,
  "id": "ai:ai-chip-brief",
  "name": "AIChipBrief",
  "namespace": "ai",
  "tier": "atoms",
  "status": "stable",
  "category": "AI",
  "description": "A status chip for agent task briefs: default, ready, missing, edited, waiting-approval, running. The status word renders as text beside the label, never as colour alone.",
  "intent": "Whether an agent task brief is ready to run — and whether a human still has to say yes.",
  "authority": {
    "source": "src/components/ai/ai-chip-brief.tsx",
    "mirrorSpec": "design-system/components/ai/ai-chip-brief/ai-chip-brief.md",
    "contract": "design-system/components/ai/ai-chip-brief/ai-chip-brief.agent.json",
    "prompt": "design-system/components/ai/ai-chip-brief/agentic-prompt.md",
    "preview": "design-system/components/ai/ai-chip-brief/ai-chip-brief.preview.html",
    "note": "src/ is authoritative. If this contract disagrees with the source, implement from the source and report the drift."
  },
  "platforms": [
    "web",
    "react"
  ],
  "dependencies": {
    "internal": [],
    "external": [
      "class-variance-authority"
    ]
  },
  "exports": [
    "AIChipBrief",
    "aiChipBriefVariants"
  ],
  "variants": [],
  "sizes": [
    "sm",
    "md"
  ],
  "states": [
    "Draft",
    "Ready",
    "Missing information",
    "Edited",
    "Waiting for approval",
    "Running"
  ],
  "props": [
    {
      "name": "status",
      "type": "\"default\" | \"ready\" | \"missing\" | \"edited\" | \"waiting-approval\" | \"running\"",
      "default": "\"default\"",
      "required": false,
      "hint": "One of the status values declared in aiChipBriefVariants."
    },
    {
      "name": "size",
      "type": "\"sm\" | \"md\"",
      "default": "\"md\"",
      "required": false,
      "hint": "One of the size values declared in aiChipBriefVariants."
    },
    {
      "name": "className",
      "type": "string",
      "required": false,
      "hint": "Merged with the component classes via cn(). Use for layout only — never to override a variant that already exists."
    }
  ],
  "javascriptApi": {
    "import": "import { AIChipBrief, aiChipBriefVariants } from \"@/components/ai/ai-chip-brief\"",
    "exports": [
      "AIChipBrief",
      "aiChipBriefVariants"
    ],
    "forwardsRef": true,
    "asChild": false,
    "notes": []
  },
  "tokens": {
    "semantic": [
      "ai-accent",
      "ai-confidence-high",
      "ai-signal",
      "ai-surface",
      "border",
      "destructive",
      "muted"
    ],
    "utilities": [
      "bg-ai-confidence-high",
      "bg-ai-signal",
      "bg-ai-surface",
      "bg-destructive",
      "bg-muted",
      "border-ai-accent",
      "border-ai-confidence-high",
      "border-ai-signal",
      "border-border",
      "border-destructive",
      "text-ai-accent",
      "text-ai-confidence-high",
      "text-ai-signal",
      "text-destructive",
      "text-muted"
    ]
  },
  "accessibility": {
    "role": "none",
    "keyboard": [],
    "requiredAttributes": [
      "label"
    ],
    "handledByRadix": false,
    "notes": [
      "The status word appears both visually and in an sr-only span, so the tint is never the sole carrier of meaning."
    ]
  },
  "rules": {
    "allowedChildren": [],
    "forbiddenChildren": [],
    "forbiddenUsage": [
      "Interactive use",
      "Colour-only status",
      "Generic badging"
    ],
    "agentRules": [
      "Never a button.",
      "waiting-approval must mean a human genuinely has to approve.",
      "Use ai:ai-queue-badge once it is executing."
    ]
  },
  "experienceMetadata": {
    "experienceMode": [
      "AI Led"
    ],
    "aiBehavior": [
      "Suggest"
    ],
    "accountability": [
      "Attribution",
      "Approval"
    ],
    "humanGestureRequired": false,
    "reversible": "not-applicable"
  },
  "relatedComponents": [
    {
      "id": "ai:ai-queue-badge",
      "note": "Execution state"
    },
    {
      "id": "ui:badge",
      "note": "Generic status"
    }
  ],
  "gaps": [],
  "generatedAt": "2026-09-11T05:07:37.563Z",
  "curated": true
}
