{
  "$schema": "../../agent-manifest.schema.json",
  "schemaVersion": 1,
  "id": "ai:ai-icon",
  "name": "AIIcon",
  "namespace": "ai",
  "tier": "atoms",
  "status": "beta",
  "category": "AI",
  "description": "Wraps any icon component with sizing, colour treatment, semantic tone, an optional container and motion. Governed by the 60-30-10 rule.",
  "intent": "A treatment layer over standard icons — not a new icon set.",
  "authority": {
    "source": "src/components/ai/ai-icon.tsx",
    "mirrorSpec": "design-system/components/ai/ai-icon/ai-icon.md",
    "contract": "design-system/components/ai/ai-icon/ai-icon.agent.json",
    "prompt": "design-system/components/ai/ai-icon/agentic-prompt.md",
    "preview": "design-system/components/ai/ai-icon/ai-icon.preview.html",
    "note": "src/ is authoritative. If this contract disagrees with the source, implement from the source and report the drift."
  },
  "platforms": [
    "web",
    "react"
  ],
  "dependencies": {
    "internal": [],
    "external": [
      "class-variance-authority"
    ]
  },
  "exports": [
    "AIIcon",
    "aiIconVariants"
  ],
  "variants": [],
  "sizes": [
    "xs",
    "sm",
    "md",
    "lg",
    "xl"
  ],
  "states": [
    "Decorative",
    "Labelled",
    "Spinning",
    "Pulsing"
  ],
  "props": [
    {
      "name": "size",
      "type": "\"xs\" | \"sm\" | \"md\" | \"lg\" | \"xl\"",
      "default": "\"md\"",
      "required": false,
      "hint": "See sizeGuidance in the mirror spec."
    },
    {
      "name": "treatment",
      "type": "\"neutral\" | \"ai\" | \"ai-contained\" | \"semantic\" | \"orange-signal\"",
      "default": "\"neutral\"",
      "required": false,
      "hint": "One of the treatment values declared in aiIconVariants."
    },
    {
      "name": "tone",
      "type": "\"default\" | \"success\" | \"warning\" | \"error\" | \"blocked\" | \"escalated\"",
      "default": "\"default\"",
      "required": false,
      "hint": "One of the tone values declared in aiIconVariants."
    },
    {
      "name": "container",
      "type": "\"true\" | \"false\"",
      "required": false,
      "hint": "One of the container values declared in aiIconVariants."
    },
    {
      "name": "motion",
      "type": "\"none\" | \"spin\" | \"pulse\"",
      "default": "\"none\"",
      "required": false,
      "hint": "One of the motion values declared in aiIconVariants."
    },
    {
      "name": "className",
      "type": "string",
      "required": false,
      "hint": "Merged with the component classes via cn(). Use for layout only — never to override a variant that already exists."
    }
  ],
  "javascriptApi": {
    "import": "import { AIIcon, aiIconVariants } from \"@/components/ai/ai-icon\"",
    "exports": [
      "AIIcon",
      "aiIconVariants"
    ],
    "forwardsRef": true,
    "asChild": false,
    "notes": []
  },
  "tokens": {
    "semantic": [
      "ai-accent",
      "ai-confidence-high",
      "ai-signal",
      "ai-surface",
      "destructive",
      "muted"
    ],
    "utilities": [
      "bg-ai-surface",
      "text-ai-accent",
      "text-ai-confidence-high",
      "text-ai-signal",
      "text-destructive",
      "text-muted"
    ]
  },
  "accessibility": {
    "role": "img or none",
    "keyboard": [],
    "requiredAttributes": [
      "Either label or decorative — one of the two, always"
    ],
    "handledByRadix": false,
    "notes": [
      "Setting neither logs a development warning. An icon with meaning and no name is invisible.",
      "All motion carries motion-reduce:animate-none.",
      "Motion must reflect real activity. A permanently spinning icon is noise that trains users to ignore it."
    ]
  },
  "rules": {
    "allowedChildren": [],
    "forbiddenChildren": [],
    "forbiddenUsage": [
      "Neither labelled nor decorative",
      "Decorative motion",
      "Overusing the AI treatment"
    ],
    "agentRules": [
      "Set either label or decorative on every instance.",
      "Follow 60-30-10 — treatment=\"ai\" is scarce.",
      "Motion must track real work.",
      "Reserve orange-signal for review and escalation."
    ]
  },
  "experienceMetadata": {
    "experienceMode": [
      "AI Assisted",
      "Adaptive",
      "AI Led"
    ],
    "aiBehavior": [
      "Suggest"
    ],
    "accountability": [
      "Attribution"
    ],
    "humanGestureRequired": false,
    "reversible": "not-applicable"
  },
  "relatedComponents": [
    {
      "id": "ai:ai-avatar",
      "note": "Agent identity, not iconography"
    }
  ],
  "gaps": [
    "The handoff-trail, completion-settle, nudge, shimmer and alert-ring motions from the source system are not implemented. Only spin and pulse."
  ],
  "generatedAt": "2026-09-11T04:20:52.939Z",
  "curated": true
}
