{
  "$schema": "../../agent-manifest.schema.json",
  "schemaVersion": 1,
  "id": "ui:form",
  "name": "Form",
  "namespace": "ui",
  "tier": "groups",
  "status": "stable",
  "category": "Forms",
  "description": "A react-hook-form integration layer. FormField provides context; FormItem generates ids; FormControl wires aria-describedby and aria-invalid; FormMessage renders the error.",
  "intent": "Wires a control to its label, description and error message so the accessibility relationships are correct by construction.",
  "authority": {
    "source": "src/components/ui/form.tsx",
    "mirrorSpec": "design-system/components/ui/form/form.md",
    "contract": "design-system/components/ui/form/form.agent.json",
    "prompt": "design-system/components/ui/form/agentic-prompt.md",
    "preview": "design-system/components/ui/form/form.preview.html",
    "upstream": "shadcn/ui registry: form",
    "note": "src/ is authoritative. If this contract disagrees with the source, implement from the source and report the drift."
  },
  "platforms": [
    "web",
    "react"
  ],
  "dependencies": {
    "internal": [
      "ui:label"
    ],
    "external": [
      "@radix-ui/react-label",
      "@radix-ui/react-slot",
      "react-hook-form"
    ],
    "radixPrimitive": "@radix-ui/react-label"
  },
  "exports": [
    "Form",
    "FormControl",
    "FormDescription",
    "FormField",
    "FormItem",
    "FormLabel",
    "FormMessage",
    "useFormField"
  ],
  "compound": {
    "root": "Form",
    "parts": [
      {
        "name": "FormField",
        "parent": "Form",
        "required": true,
        "note": "Provides the react-hook-form Controller and field name context"
      },
      {
        "name": "FormItem",
        "parent": "FormField",
        "required": true,
        "note": "Generates the id namespace that ties label, control, description and message together"
      },
      {
        "name": "FormLabel",
        "parent": "FormItem",
        "required": true,
        "note": "htmlFor is supplied automatically. Turns text-destructive on error."
      },
      {
        "name": "FormControl",
        "parent": "FormItem",
        "required": true,
        "note": "A Slot. Wraps exactly one control and injects id, aria-describedby and aria-invalid."
      },
      {
        "name": "FormDescription",
        "parent": "FormItem",
        "required": false,
        "note": "Helper text, automatically referenced by aria-describedby"
      },
      {
        "name": "FormMessage",
        "parent": "FormItem",
        "required": false,
        "note": "The validation error. Renders nothing when valid."
      }
    ]
  },
  "variants": [],
  "sizes": [],
  "states": [
    "Pristine",
    "Invalid",
    "Submitting"
  ],
  "props": [
    {
      "name": "className",
      "type": "string",
      "required": false,
      "hint": "Merged with the component classes via cn(). Use for layout only — never to override a variant that already exists."
    }
  ],
  "javascriptApi": {
    "import": "import { Form, FormControl, FormDescription, … } from \"@/components/ui/form\"",
    "exports": [
      "Form",
      "FormControl",
      "FormDescription",
      "FormField",
      "FormItem",
      "FormLabel",
      "FormMessage",
      "useFormField"
    ],
    "forwardsRef": true,
    "asChild": false,
    "notes": []
  },
  "tokens": {
    "semantic": [
      "destructive",
      "muted"
    ],
    "utilities": [
      "text-destructive",
      "text-muted"
    ]
  },
  "accessibility": {
    "role": "form",
    "keyboard": [
      "Tab through fields",
      "Enter submits from a single-line input"
    ],
    "requiredAttributes": [
      "Generated automatically: id, aria-describedby, aria-invalid"
    ],
    "handledByRadix": false,
    "notes": [
      "This is the reason to use ui:form at all — the ARIA wiring is generated, not hand-written, so it cannot drift.",
      "FormControl must wrap exactly one element. Two children breaks the Slot.",
      "On failed submit, move focus to the first invalid field. react-hook-form does not do this for you."
    ]
  },
  "rules": {
    "allowedChildren": [
      "FormField",
      "FormItem",
      "FormLabel",
      "FormControl",
      "FormDescription",
      "FormMessage"
    ],
    "forbiddenChildren": [],
    "forbiddenUsage": [
      "FormControl with multiple children",
      "Parts used outside their required parent",
      "Manual aria-invalid on a wrapped control"
    ],
    "agentRules": [
      "The five parts are inseparable. Do not use FormLabel outside FormItem.",
      "FormControl wraps exactly one control.",
      "Never hand-write aria-describedby inside a form — you will fight the generated value.",
      "Move focus to the first invalid field after a failed submit.",
      "One submit button."
    ]
  },
  "relatedComponents": [
    {
      "id": "ui:label",
      "note": "Standalone labelling outside a form"
    },
    {
      "id": "ui:input",
      "note": "The usual wrapped control"
    }
  ],
  "gaps": [
    "Does not move focus to the first invalid field on submit — implement that in your onInvalid handler."
  ],
  "generatedAt": "2026-09-11T04:06:31.464Z",
  "curated": true
}
